{
  "ok": true,
  "result_schema_valid": true,
  "decision_valid": true,
  "limitations_acknowledged": true,
  "artifacts_checked_shape_valid": true,
  "forbidden_patterns_absent": true,
  "validated_schema_id": "https://veritas-os.example/schemas/reviewer_handoff_review_result.schema.json",
  "report_schema_id": "https://veritas-os.example/schemas/reviewer_handoff_review_result_validation_report.schema.json",
  "validator": "veritas-evidence-bundle validate-review-result",
  "errors": []
}
